{"city":"delhi","samvatsara":{"year":2026,"id":"parabhava","n":40},"start":"2026-03-19","end":"2027-04-06","days":[{"date":"2026-03-19","sunrise":"06:26","sunset":"18:31","tithi":30,"tithi_ends":"2026-03-19T06:54","nakshatra":26,"nakshatra_ends":"2026-03-20T04:05","masa":12,"adhika":false,"moon_rashi":12,"moon_pct":0,"observances":[]},{"date":"2026-03-20","sunrise":"06:25","sunset":"18:32","tithi":2,"tithi_ends":"2026-03-21T02:31","nakshatra":27,"nakshatra_ends":"2026-03-21T02:27","masa":1,"adhika":false,"moon_rashi":12,"moon_pct":1,"observances":[]},{"date":"2026-03-21","sunrise":"06:24","sunset":"18:33","tithi":3,"tithi_ends":"2026-03-21T23:57","nakshatra":1,"nakshatra_ends":"2026-03-22T00:37","masa":1,"adhika":false,"moon_rashi":1,"moon_pct":5,"observances":[]},{"date":"2026-03-22","sunrise":"06:22","sunset":"18:33","tithi":4,"tithi_ends":"2026-03-22T21:17","nakshatra":2,"nakshatra_ends":"2026-03-22T22:42","masa":1,"adhika":false,"moon_rashi":1,"moon_pct":12,"observances":[]},{"date":"2026-03-23","sunrise":"06:21","sunset":"18:34","tithi":5,"tithi_ends":"2026-03-23T18:39","nakshatra":3,"nakshatra_ends":"2026-03-23T20:49","masa":1,"adhika":false,"moon_rashi":2,"moon_pct":20,"observances":[]},{"date":"2026-03-24","sunrise":"06:20","sunset":"18:34","tithi":6,"tithi_ends":"2026-03-24T16:08","nakshatra":4,"nakshatra_ends":"2026-03-24T19:05","masa":1,"adhika":false,"moon_rashi":2,"moon_pct":30,"observances":[]},{"date":"2026-03-25","sunrise":"06:19","sunset":"18:35","tithi":7,"tithi_ends":"2026-03-25T13:51","nakshatra":5,"nakshatra_ends":"2026-03-25T17:33","masa":1,"adhika":false,"moon_rashi":3,"moon_pct":41,"observances":[]},{"date":"2026-03-26","sunrise":"06:18","sunset":"18:35","tithi":8,"tithi_ends":"2026-03-26T11:49","nakshatra":6,"nakshatra_ends":"2026-03-26T16:19","masa":1,"adhika":false,"moon_rashi":3,"moon_pct":53,"observances":[]},{"date":"2026-03-27","sunrise":"06:17","sunset":"18:36","tithi":9,"tithi_ends":"2026-03-27T10:08","nakshatra":7,"nakshatra_ends":"2026-03-27T15:24","masa":1,"adhika":false,"moon_rashi":3,"moon_pct":64,"observances":[]},{"date":"2026-03-28","sunrise":"06:15","sunset":"18:37","tithi":10,"tithi_ends":"2026-03-28T08:46","nakshatra":8,"nakshatra_ends":"2026-03-28T14:50","masa":1,"adhika":false,"moon_rashi":4,"moon_pct":74,"observances":[]},{"date":"2026-03-29","sunrise":"06:14","sunset":"18:37","tithi":11,"tithi_ends":"2026-03-29T07:47","nakshatra":9,"nakshatra_ends":"2026-03-29T14:38","masa":1,"adhika":false,"moon_rashi":4,"moon_pct":83,"observances":[]},{"date":"2026-03-30","sunrise":"06:13","sunset":"18:38","tithi":12,"tithi_ends":"2026-03-30T07:10","nakshatra":10,"nakshatra_ends":"2026-03-30T14:48","masa":1,"adhika":false,"moon_rashi":5,"moon_pct":90,"observances":[]},{"date":"2026-03-31","sunrise":"06:12","sunset":"18:38","tithi":13,"tithi_ends":"2026-03-31T06:57","nakshatra":11,"nakshatra_ends":"2026-03-31T15:21","masa":1,"adhika":false,"moon_rashi":5,"moon_pct":96,"observances":[]},{"date":"2026-04-01","sunrise":"06:11","sunset":"18:39","tithi":14,"tithi_ends":"2026-04-01T07:07","nakshatra":12,"nakshatra_ends":"2026-04-01T16:17","masa":1,"adhika":false,"moon_rashi":6,"moon_pct":99,"observances":[]},{"date":"2026-04-02","sunrise":"06:10","sunset":"18:39","tithi":15,"tithi_ends":"2026-04-02T07:42","nakshatra":13,"nakshatra_ends":"2026-04-02T17:38","masa":1,"adhika":false,"moon_rashi":6,"moon_pct":100,"observances":[]},{"date":"2026-04-03","sunrise":"06:09","sunset":"18:40","tithi":16,"tithi_ends":"2026-04-03T08:43","nakshatra":14,"nakshatra_ends":"2026-04-03T19:25","masa":1,"adhika":false,"moon_rashi":6,"moon_pct":99,"observances":[]},{"date":"2026-04-04","sunrise":"06:07","sunset":"18:40","tithi":17,"tithi_ends":"2026-04-04T10:10","nakshatra":15,"nakshatra_ends":"2026-04-04T21:35","masa":1,"adhika":false,"moon_rashi":7,"moon_pct":96,"observances":[]},{"date":"2026-04-05","sunrise":"06:06","sunset":"18:41","tithi":18,"tithi_ends":"2026-04-05T12:00","nakshatra":16,"nakshatra_ends":"2026-04-06T00:07","masa":1,"adhika":false,"moon_rashi":7,"moon_pct":92,"observances":["obs.sankashti-chaturthi"]},{"date":"2026-04-06","sunrise":"06:05","sunset":"18:42","tithi":19,"tithi_ends":"2026-04-06T14:11","nakshatra":17,"nakshatra_ends":"2026-04-07T02:56","masa":1,"adhika":false,"moon_rashi":8,"moon_pct":86,"observances":[]},{"date":"2026-04-07","sunrise":"06:04","sunset":"18:42","tithi":20,"tithi_ends":"2026-04-07T16:35","nakshatra":18,"nakshatra_ends":"2026-04-08T05:54","masa":1,"adhika":false,"moon_rashi":8,"moon_pct":78,"observances":[]},{"date":"2026-04-08","sunrise":"06:03","sunset":"18:43","tithi":21,"tithi_ends":"2026-04-08T19:02","nakshatra":19,"nakshatra_ends":"2026-04-09T08:48","masa":1,"adhika":false,"moon_rashi":9,"moon_pct":70,"observances":[]},{"date":"2026-04-09","sunrise":"06:02","sunset":"18:43","tithi":22,"tithi_ends":"2026-04-09T21:20","nakshatra":19,"nakshatra_ends":"2026-04-09T08:48","masa":1,"adhika":false,"moon_rashi":9,"moon_pct":61,"observances":[]},{"date":"2026-04-10","sunrise":"06:01","sunset":"18:44","tithi":23,"tithi_ends":"2026-04-10T23:16","nakshatra":20,"nakshatra_ends":"2026-04-10T11:28","masa":1,"adhika":false,"moon_rashi":9,"moon_pct":52,"observances":[]},{"date":"2026-04-11","sunrise":"06:00","sunset":"18:44","tithi":24,"tithi_ends":"2026-04-12T00:38","nakshatra":21,"nakshatra_ends":"2026-04-11T13:40","masa":1,"adhika":false,"moon_rashi":10,"moon_pct":42,"observances":[]},{"date":"2026-04-12","sunrise":"05:58","sunset":"18:45","tithi":25,"tithi_ends":"2026-04-13T01:18","nakshatra":22,"nakshatra_ends":"2026-04-12T15:14","masa":1,"adhika":false,"moon_rashi":10,"moon_pct":33,"observances":[]},{"date":"2026-04-13","sunrise":"05:57","sunset":"18:45","tithi":26,"tithi_ends":"2026-04-14T01:09","nakshatra":23,"nakshatra_ends":"2026-04-13T16:03","masa":1,"adhika":false,"moon_rashi":11,"moon_pct":23,"observances":[]},{"date":"2026-04-14","sunrise":"05:56","sunset":"18:46","tithi":27,"tithi_ends":"2026-04-15T00:13","nakshatra":24,"nakshatra_ends":"2026-04-14T16:06","masa":1,"adhika":false,"moon_rashi":11,"moon_pct":15,"observances":[]},{"date":"2026-04-15","sunrise":"05:55","sunset":"18:47","tithi":28,"tithi_ends":"2026-04-15T22:32","nakshatra":25,"nakshatra_ends":"2026-04-15T15:22","masa":1,"adhika":false,"moon_rashi":11,"moon_pct":8,"observances":[]},{"date":"2026-04-16","sunrise":"05:54","sunset":"18:47","tithi":29,"tithi_ends":"2026-04-16T20:12","nakshatra":26,"nakshatra_ends":"2026-04-16T13:59","masa":1,"adhika":false,"moon_rashi":12,"moon_pct":3,"observances":[]},{"date":"2026-04-17","sunrise":"05:53","sunset":"18:48","tithi":30,"tithi_ends":"2026-04-17T17:22","nakshatra":27,"nakshatra_ends":"2026-04-17T12:02","masa":1,"adhika":false,"moon_rashi":12,"moon_pct":0,"observances":[]},{"date":"2026-04-18","sunrise":"05:52","sunset":"18:48","tithi":1,"tithi_ends":"2026-04-18T14:11","nakshatra":1,"nakshatra_ends":"2026-04-18T09:42","masa":2,"adhika":false,"moon_rashi":1,"moon_pct":1,"observances":[]},{"date":"2026-04-19","sunrise":"05:51","sunset":"18:49","tithi":2,"tithi_ends":"2026-04-19T10:50","nakshatra":2,"nakshatra_ends":"2026-04-19T07:10","masa":2,"adhika":false,"moon_rashi":1,"moon_pct":4,"observances":[]},{"date":"2026-04-20","sunrise":"05:50","sunset":"18:49","tithi":3,"tithi_ends":"2026-04-20T07:28","nakshatra":4,"nakshatra_ends":"2026-04-21T02:08","masa":2,"adhika":false,"moon_rashi":2,"moon_pct":9,"observances":[]},{"date":"2026-04-21","sunrise":"05:49","sunset":"18:50","tithi":5,"tithi_ends":"2026-04-22T01:20","nakshatra":5,"nakshatra_ends":"2026-04-21T23:58","masa":2,"adhika":false,"moon_rashi":2,"moon_pct":17,"observances":[]},{"date":"2026-04-22","sunrise":"05:48","sunset":"18:51","tithi":6,"tithi_ends":"2026-04-22T22:50","nakshatra":6,"nakshatra_ends":"2026-04-22T22:13","masa":2,"adhika":false,"moon_rashi":3,"moon_pct":27,"observances":[]},{"date":"2026-04-23","sunrise":"05:47","sunset":"18:51","tithi":7,"tithi_ends":"2026-04-23T20:50","nakshatra":7,"nakshatra_ends":"2026-04-23T20:57","masa":2,"adhika":false,"moon_rashi":3,"moon_pct":38,"observances":[]},{"date":"2026-04-24","sunrise":"05:46","sunset":"18:52","tithi":8,"tithi_ends":"2026-04-24T19:22","nakshatra":8,"nakshatra_ends":"2026-04-24T20:14","masa":2,"adhika":false,"moon_rashi":4,"moon_pct":49,"observances":[]},{"date":"2026-04-25","sunrise":"05:45","sunset":"18:52","tithi":9,"tithi_ends":"2026-04-25T18:29","nakshatra":9,"nakshatra_ends":"2026-04-25T20:05","masa":2,"adhika":false,"moon_rashi":4,"moon_pct":60,"observances":[]},{"date":"2026-04-26","sunrise":"05:44","sunset":"18:53","tithi":10,"tithi_ends":"2026-04-26T18:08","nakshatra":10,"nakshatra_ends":"2026-04-26T20:27","masa":2,"adhika":false,"moon_rashi":5,"moon_pct":70,"observances":[]},{"date":"2026-04-27","sunrise":"05:43","sunset":"18:54","tithi":11,"tithi_ends":"2026-04-27T18:17","nakshatra":11,"nakshatra_ends":"2026-04-27T21:18","masa":2,"adhika":false,"moon_rashi":5,"moon_pct":79,"observances":[]},{"date":"2026-04-28","sunrise":"05:43","sunset":"18:54","tithi":12,"tithi_ends":"2026-04-28T18:53","nakshatra":12,"nakshatra_ends":"2026-04-28T22:36","masa":2,"adhika":false,"moon_rashi":6,"moon_pct":87,"observances":[]},{"date":"2026-04-29","sunrise":"05:42","sunset":"18:55","tithi":13,"tithi_ends":"2026-04-29T19:52","nakshatra":13,"nakshatra_ends":"2026-04-30T00:16","masa":2,"adhika":false,"moon_rashi":6,"moon_pct":93,"observances":[]},{"date":"2026-04-30","sunrise":"05:41","sunset":"18:55","tithi":14,"tithi_ends":"2026-04-30T21:13","nakshatra":14,"nakshatra_ends":"2026-05-01T02:16","masa":2,"adhika":false,"moon_rashi":6,"moon_pct":97,"observances":[]},{"date":"2026-05-01","sunrise":"05:40","sunset":"18:56","tithi":15,"tithi_ends":"2026-05-01T22:53","nakshatra":15,"nakshatra_ends":"2026-05-02T04:35","masa":2,"adhika":false,"moon_rashi":7,"moon_pct":99,"observances":[]},{"date":"2026-05-02","sunrise":"05:39","sunset":"18:57","tithi":16,"tithi_ends":"2026-05-03T00:51","nakshatra":16,"nakshatra_ends":"2026-05-03T07:10","masa":2,"adhika"